{
  "metadata": {
    "store_id": "GA",
    "store_name": "GA",
    "base": "TV_TOWER",
    "fiscal_year": "",
    "quarter": "4Q",
    "source_file": "TV2023_4Q.xlsx",
    "parsed_at": "2026-02-11T20:22:04.805828",
    "sheets": [
      "2024.01",
      "2024.02",
      "2024.03"
    ],
    "total_days": 93,
    "total_months": 3
  },
  "monthly_summary": [
    {
      "month": "2024-01",
      "channels": {
        "lunch": {
          "pax": 709,
          "sales": 3446550,
          "avg_spend": 4861.14
        },
        "dinner": {
          "pax": 428,
          "sales": 5277508,
          "avg_spend": 12330.63
        },
        "ld_total": {
          "pax": 1137,
          "sales": 8724058
        },
        "takeout": {
          "pax": 423,
          "sales": 309660
        },
        "banquet": {
          "pax": 42,
          "sales": 257520
        },
        "beer_garden": {
          "pax": 0,
          "sales": 0
        },
        "all_channels": {
          "sales": 9197738
        }
      }
    },
    {
      "month": "2024-02",
      "channels": {
        "lunch": {
          "pax": 738,
          "sales": 3381475,
          "avg_spend": 4581.94
        },
        "dinner": {
          "pax": 487,
          "sales": 6073670,
          "avg_spend": 12471.6
        },
        "ld_total": {
          "pax": 1225,
          "sales": 9455145
        },
        "takeout": {
          "pax": 777,
          "sales": 458220
        },
        "banquet": {
          "pax": 274,
          "sales": 1594449
        },
        "beer_garden": {
          "pax": 0,
          "sales": 0
        },
        "all_channels": {
          "sales": 11440164
        }
      }
    },
    {
      "month": "2024-03",
      "channels": {
        "lunch": {
          "pax": 817,
          "sales": 3844575,
          "avg_spend": 4705.72
        },
        "dinner": {
          "pax": 485,
          "sales": 6048085,
          "avg_spend": 12470.28
        },
        "ld_total": {
          "pax": 1302,
          "sales": 9892660
        },
        "takeout": {
          "pax": 884,
          "sales": 498550
        },
        "banquet": {
          "pax": 338,
          "sales": 1904374
        },
        "beer_garden": {
          "pax": 0,
          "sales": 0
        },
        "all_channels": {
          "sales": 12201534
        }
      }
    }
  ],
  "daily_data": [
    {
      "date": "2024-01-01",
      "weekday": 0,
      "channels": {
        "lunch": {
          "pax": 0,
          "sales": 0
        },
        "dinner": {
          "pax": 0,
          "sales": 0
        },
        "takeout": {
          "pax": 0,
          "sales": 0
        },
        "banquet": {
          "pax": 0,
          "sales": 0
        },
        "beer_garden": {
          "pax": 0,
          "sales": 0
        }
      }
    },
    {
      "date": "2024-01-02",
      "weekday": 1,
      "channels": {
        "lunch": {
          "pax": 19,
          "sales": 125580
        },
        "dinner": {
          "pax": 28,
          "sales": 324750
        },
        "takeout": {
          "pax": 5,
          "sales": 6500
        },
        "banquet": {
          "pax": 0,
          "sales": 0
        },
        "beer_garden": {
          "pax": 0,
          "sales": 0
        }
      }
    },
    {
      "date": "2024-01-03",
      "weekday": 2,
      "channels": {
        "lunch": {
          "pax": 25,
          "sales": 135000
        },
        "dinner": {
          "pax": 21,
          "sales": 256830
        },
        "takeout": {
          "pax": 5,
          "sales": 3960
        },
        "banquet": {
          "pax": 0,
          "sales": 0
        },
        "beer_garden": {
          "pax": 0,
          "sales": 0
        }
      }
    },
    {
      "date": "2024-01-04",
      "weekday": 3,
      "channels": {
        "lunch": {
          "pax": 13,
          "sales": 98330
        },
        "dinner": {
          "pax": 10,
          "sales": 115190
        },
        "takeout": {
          "pax": 7,
          "sales": 6250
        },
        "banquet": {
          "pax": 0,
          "sales": 0
        },
        "beer_garden": {
          "pax": 0,
          "sales": 0
        }
      }
    },
    {
      "date": "2024-01-05",
      "weekday": 4,
      "channels": {
        "lunch": {
          "pax": 17,
          "sales": 65390
        },
        "dinner": {
          "pax": 14,
          "sales": 124810
        },
        "takeout": {
          "pax": 16,
          "sales": 14180
        },
        "banquet": {
          "pax": 0,
          "sales": 0
        },
        "beer_garden": {
          "pax": 0,
          "sales": 0
        }
      }
    },
    {
      "date": "2024-01-06",
      "weekday": 5,
      "channels": {
        "lunch": {
          "pax": 23,
          "sales": 92880
        },
        "dinner": {
          "pax": 25,
          "sales": 310940
        },
        "takeout": {
          "pax": 11,
          "sales": 10500
        },
        "banquet": {
          "pax": 0,
          "sales": 0
        },
        "beer_garden": {
          "pax": 0,
          "sales": 0
        }
      }
    },
    {
      "date": "2024-01-07",
      "weekday": 6,
      "channels": {
        "lunch": {
          "pax": 23,
          "sales": 120330
        },
        "dinner": {
          "pax": 11,
          "sales": 122550
        },
        "takeout": {
          "pax": 6,
          "sales": 5800
        },
        "banquet": {
          "pax": 0,
          "sales": 0
        },
        "beer_garden": {
          "pax": 0,
          "sales": 0
        }
      }
    },
    {
      "date": "2024-01-08",
      "weekday": 0,
      "channels": {
        "lunch": {
          "pax": 31,
          "sales": 176030
        },
        "dinner": {
          "pax": 13,
          "sales": 130783
        },
        "takeout": {
          "pax": 5,
          "sales": 15450
        },
        "banquet": {
          "pax": 0,
          "sales": 0
        },
        "beer_garden": {
          "pax": 0,
          "sales": 0
        }
      }
    },
    {
      "date": "2024-01-09",
      "weekday": 1,
      "channels": {
        "lunch": {
          "pax": 23,
          "sales": 100210
        },
        "dinner": {
          "pax": 12,
          "sales": 127490
        },
        "takeout": {
          "pax": 3,
          "sales": 4050
        },
        "banquet": {
          "pax": 0,
          "sales": 0
        },
        "beer_garden": {
          "pax": 0,
          "sales": 0
        }
      }
    },
    {
      "date": "2024-01-10",
      "weekday": 2,
      "channels": {
        "lunch": {
          "pax": 24,
          "sales": 94490
        },
        "dinner": {
          "pax": 7,
          "sales": 62590
        },
        "takeout": {
          "pax": 5,
          "sales": 5350
        },
        "banquet": {
          "pax": 0,
          "sales": 0
        },
        "beer_garden": {
          "pax": 0,
          "sales": 0
        }
      }
    },
    {
      "date": "2024-01-11",
      "weekday": 3,
      "channels": {
        "lunch": {
          "pax": 22,
          "sales": 95150
        },
        "dinner": {
          "pax": 4,
          "sales": 49820
        },
        "takeout": {
          "pax": 2,
          "sales": 1100
        },
        "banquet": {
          "pax": 0,
          "sales": 0
        },
        "beer_garden": {
          "pax": 0,
          "sales": 0
        }
      }
    },
    {
      "date": "2024-01-12",
      "weekday": 4,
      "channels": {
        "lunch": {
          "pax": 35,
          "sales": 145230
        },
        "dinner": {
          "pax": 5,
          "sales": 91680
        },
        "takeout": {
          "pax": 9,
          "sales": 9760
        },
        "banquet": {
          "pax": 0,
          "sales": 0
        },
        "beer_garden": {
          "pax": 0,
          "sales": 0
        }
      }
    },
    {
      "date": "2024-01-13",
      "weekday": 5,
      "channels": {
        "lunch": {
          "pax": 16,
          "sales": 75020
        },
        "dinner": {
          "pax": 4,
          "sales": 56480
        },
        "takeout": {
          "pax": 3,
          "sales": 5600
        },
        "banquet": {
          "pax": 0,
          "sales": 0
        },
        "beer_garden": {
          "pax": 0,
          "sales": 0
        }
      }
    },
    {
      "date": "2024-01-14",
      "weekday": 6,
      "channels": {
        "lunch": {
          "pax": 31,
          "sales": 165020
        },
        "dinner": {
          "pax": 5,
          "sales": 77880
        },
        "takeout": {
          "pax": 20,
          "sales": 18900
        },
        "banquet": {
          "pax": 0,
          "sales": 0
        },
        "beer_garden": {
          "pax": 0,
          "sales": 0
        }
      }
    },
    {
      "date": "2024-01-15",
      "weekday": 0,
      "channels": {
        "lunch": {
          "pax": 31,
          "sales": 110430
        },
        "dinner": {
          "pax": 8,
          "sales": 136500
        },
        "takeout": {
          "pax": 6,
          "sales": 7300
        },
        "banquet": {
          "pax": 0,
          "sales": 0
        },
        "beer_garden": {
          "pax": 0,
          "sales": 0
        }
      }
    },
    {
      "date": "2024-01-16",
      "weekday": 1,
      "channels": {
        "lunch": {
          "pax": 14,
          "sales": 51150
        },
        "dinner": {
          "pax": 9,
          "sales": 133870
        },
        "takeout": {
          "pax": 6,
          "sales": 6410
        },
        "banquet": {
          "pax": 20,
          "sales": 104400
        },
        "beer_garden": {
          "pax": 0,
          "sales": 0
        }
      }
    },
    {
      "date": "2024-01-17",
      "weekday": 2,
      "channels": {
        "lunch": {